{
  "contract_version": "1.0.0",
  "case_id": "example-circular-pair",
  "problem_class": "point_nbody",
  "frame": {
    "type": "inertial_cartesian",
    "units": "SI"
  },
  "forces": [
    {
      "type": "koppa_pairwise"
    }
  ],
  "bodies": [
    {
      "id": "primary",
      "position_m": [-666666666.6666666, 0, 0],
      "velocity_m_s": [0, -346.17051265463914, 0],
      "koppa_m": 0.001,
      "collision_radius_m": 0
    },
    {
      "id": "secondary",
      "position_m": [333333333.3333333, 0, 0],
      "velocity_m_s": [0, 173.08525632731957, 0],
      "koppa_m": 0.002,
      "collision_radius_m": 0
    }
  ],
  "integrator": "velocity_verlet",
  "timestep_s": 1,
  "duration_s": 100,
  "record_every_steps": 10,
  "tolerances": {
    "position_m": 1e-10,
    "velocity_m_s": 1e-10,
    "quaternion_norm": 1e-12,
    "max_constraint_iterations": 64
  },
  "gates": [
    {
      "id": "energy",
      "metric": "relative_energy_drift",
      "relation": "<=",
      "limit": 1e-6
    }
  ]
}
